{
  "run_id": "run-release-v42",
  "slack_channel_id": "C0C1H02UHEW",
  "slack_thread_ts": "1789306404.361089",
  "slack_reply_ts": "1789306699.812559",
  "slack_reply_status": "published",
  "linear_issue_id": "7ba54809-6cc0-41da-9258-e99f8908b575",
  "linear_comment_id": "d94a2b69-a255-4f44-a3a8-7f94f72d9dca",
  "linear_comment_status": "published",
  "github_branch": "invariant/regression-release-v42",
  "github_pr_number": 1,
  "github_head_sha": "c74ea2d90c11765304e03787b294c4a76fa510e8",
  "github_pr_status": "published",
  "ci_run_id": "34765110314",
  "ci_bound": true
}
